{
  "version": 1,
  "name": "Northwind Huila launch",
  "request": "Launch the Huila single-origin on Nov 1: research angles, then write an email and a product page, review both, and publish after I approve.",
  "agents": [
    {
      "id": "researcher",
      "name": "Researcher",
      "provider": "anthropic",
      "model": "claude-haiku-5-5",
      "effort": "low",
      "tools": [
        "files"
      ]
    },
    {
      "id": "writer",
      "name": "Writer",
      "provider": "anthropic",
      "model": "claude-sonnet-5-5",
      "effort": "medium",
      "tools": [
        "files"
      ]
    },
    {
      "id": "reviewer",
      "name": "Reviewer",
      "provider": "anthropic",
      "model": "claude-opus-5-5",
      "effort": "medium",
      "tools": [
        "files"
      ]
    }
  ],
  "steps": [
    {
      "id": "angles",
      "agent": "researcher",
      "task": "Pick launch angles",
      "prompt": "Read northwind/company.md. Write northwind/launch/angles.md: three short launch angles for the Huila single-origin (one line each, plus who it appeals to). Use only facts in company.md.",
      "stage": 0,
      "approval": "never"
    },
    {
      "id": "email",
      "agent": "writer",
      "task": "Write launch email",
      "prompt": "Using northwind/company.md and northwind/launch/angles.md, write a launch email (under 150 words, subject line included) to northwind/launch/email.md. Follow the voice rules in company.md.",
      "stage": 1,
      "approval": "never"
    },
    {
      "id": "page",
      "agent": "writer",
      "task": "Write product page",
      "prompt": "Using northwind/company.md and northwind/launch/angles.md, write the Huila product page copy (headline, 3 short paragraphs, tasting notes, price, subscription mention) to northwind/launch/page.md. Follow the voice rules in company.md.",
      "stage": 1,
      "approval": "never"
    },
    {
      "id": "review",
      "agent": "reviewer",
      "task": "Check facts and voice",
      "prompt": "Read northwind/company.md, northwind/launch/email.md and northwind/launch/page.md. Check every claim against company.md and the voice rules (no hype words, no health claims). Fix problems directly in the two files and write northwind/launch/review.md listing what you changed.",
      "stage": 2,
      "approval": "never"
    },
    {
      "id": "publish",
      "agent": "writer",
      "task": "Publish to send folder",
      "prompt": "Copy the final email and page into northwind/outbox/email.md and northwind/outbox/page.md, ready to send on Nov 1.",
      "stage": 3,
      "approval": "always",
      "asks": "wants to put the Huila launch email and page in the outbox"
    }
  ]
}
